Senior Backend Software Engineer - GenAI (Conversational Experience),Canva,Designing, developing, and optimizing high-performance backend services that power Canva’s Conversational AI experiences.
Working closely with AI r...
Senior Backend Software Engineer | AU,Harrison-AI Pty Ltd,As a Senior Software Engineer at Annalise.ai, you will play a key role in developing innovative software solutions that integrate AI models into ou...
Senior Engineer - Data Engineering,Slalom,Data Engineering capability is focusing on deep Engineering and building out the Platform to support data lifecycles and processes. This includes D...
Asset Performance Engineer,Fluence,As an Asset Performance Engineer, your role will focus on managing both pre-sales and post-sales relationships with clients in a consultative manne...
Data Engineer (Mid level),Trideca Pty Ltd,We are seeking a talented Mid-Level Data Engineer with a strong background in graph databases and data analysis to join our dynamic team. In this r...
Software Engineer, Application Modernisation,MongoDB,MongoDB is looking for a software engineer who is passionate about usability, clean design, and data-intensive applications to join our team. A suc...
Senior Production Engineer - 12 months contract,Advanced Navigation,The Senior Production Engineer is responsible for ensuring that the material, people and equipment required to build a new product are set up in th...
Senior Solutions Engineer,Atlassian,Atlassian is seeking an exceptional Solutions Engineer who is passionate about addressing complex customer challenges and securing significant ente...
Senior Software Engineers AI focus - (Typescript/Node/React/AWS),Squiz Australia Pty Ltd,We're seeking a number of Senior Software Engineers to join our product engineering team on a permanent basis, with a focus on improving the Artifi...
Senior Software Engineer,Anduril,At Anduril Australia we are developing un-crewed maritime and air domain systems that leverage unsupervised autonomy for the delivery of long endur...
Technical Lead (AI-Focused) Brisbane-Based,NetEngine,As part of Scout Talent Group, NetEngine is scaling AI adoption across its software solutions, and we’re looking for a Technical Lead (AI-Focused) ...
Senior Software Engineers AI focus - (Typescript/Node/React/AWS),Squiz Australia Pty Ltd,We're seeking a number of Senior Software Engineers to join our product engineering team on a permanent basis, with a focus on improving the Artifi...
SAS Architect,Virtusa,Data Architect to lead the migration of our SAS-based analytics platform to Microsoft Azure. The ideal candidate will have deep expertise in SAS ar...
Senior Software Engineers (AI Focus) - Typescript/Node/React/AWS,Squiz Australia Pty Ltd,We're seeking a number of Senior Software Engineers to join our product engineering team on a permanent basis, with a focus on improving the Artifi...
Senior Software Engineer,Audience Republic,Are you an experience software engineer looking to join an early stage startup? Are you looking to join a small but nimble team and have a massive ...
IT Business Analysis, Assistant Vice President, Onsite,State Street Services Australia Pty Ltd,We are looking for a lead SQA resource who can execute / supervise team of test engineers for executing on a large IT initiative. The resource shou...
