Job Title, Company, Job Details
AI-Enabled Software Engineer | 7x,BLACKROC,Revolutionise fintech with AI! Join a venture-backed UK start-up,  where AI codes 90%. Great base + equity. Master JS, Python, blockchain.
AI Engineer,Profusion PAC Pty Ltd,AI Engineer needed. Large finance client. Great daily rate. 12+ mths Develop & deploy key AI /ML models. Finance / Super/ Funds/ Wealth exp preferred
AI Engineer,Linka Search Pty Ltd,We are on the hunt for a driven AI Engineer looking to make an impact in a high growth environment!
AI Engineer,Real Time,Revolutionise healthcare with AI agents that guide real-time decisions for millions. Join a mission-driven team and transform digital health for good!
Dev Opps / AI Engineer,Ethan Talent,Exciting opportunity to become involved with a market leader
Customer Engineer, Applied AI, Google Cloud,Google,Develop and deliver proofs-of-concept, demos, and technical workshops to showcase the power of Google Cloud AI/ML.
Generative AI Engineer,Morgan McKinley,Are you a Generative AI Engineer who has a passion for building new products?
AI/ML & Data Consultant,Vivanti Consulting Pty Ltd,We are seeking an AI/ML and Data Consultant to join our team of curious technologists!
AI-Enabled Software Engineer | 7x,BLACKROC,Revolutionise fintech with AI! Join a venture-backed UK start-up,  where AI codes 90%. Great base + equity. Master JS, Python, blockchain.
GenAI Engineer,Brennan Sourcing,GenAI Engineer | Help deliver cutting edge GenAI solutions across the Enterprise | Retail Sector
AI Engineer,Woods & Co,Join a fast-growing AI consultancy and partner with enterprises to drive AI adoption, securely and at scale.
AI DevOps Engineer,Talent – Specialists in tech, transformation & beyond,Title: AI DevOps Engineer
Location: Sydney (WFH Hybrid)
Rate: $620/day inc. super
Contract: 6 months (rolling, visibility to 12 months)
Start: ASAP
Machine Learning & Data Engineer,Fundo Loans,Join Fundo, just awarded Finder's AI Innovation Award 2024 and work with a small and highly talented team
AI Tools Consultant,Morgan McKinley,Leverage your AI expertise to drive business growth in large top tier organisation.
Junior Software Engineer,Elula,Are you an awesome engineer who jumps at the opportunity to work autonomously on open-ended problems wanting to meet your potential?
AI/ML Product and research analyst,Suraksha,Mandatory Requirements:
PhD qualification in the related field such as Machine learning, Artificial Intelligence, and Natural Language Processing.
Principal Machine Learning Engineer,The Onset,The AI team is tackling some of the most complex challenges in geospatial intelligence.
Research Engineer - Machine Learning,Lockheed Martin Australia Pty Ltd,Join a talented and innovative team  innovative team who are contributing to groundbreaking research and the development of next-generation solutions.
Lead/Principal Software Engineer,Lookahead,Bring your love of experimentation and your experience with large scale distributed systems at this AI-focused company
Machine Learning Engineer,Nuage Technology Group,Join an innovative startup as one of their founding ML Engineers and help build some of the country's coolest tech.
AI-Enabled Software Engineer | 7x,BLACKROC,Revolutionise fintech with AI! Join a venture-backed UK start-up,  where AI codes 90%. Great base + equity. Master JS, Python, blockchain.
Machine Learning & Data Engineer,Fundo Loans,Join Fundo, just awarded Finder's AI Innovation Award 2024 and work with a small and highly talented team
Software Engineer (Gen AI Chatbot Development),Commonwealth Bank – Technology,The successful candidate will be responsible for designing, developing and implementing chatbot solutions using Azure, ServiceNow and Microsoft Teams.
ML/AI Engineer,The Onset,Want to scale an AI-driven platform? A platform that boosts compliance/legal teams' productivity, revolutionising operations in the regtech industry.
Math Prompt Engineer,Outlier,This freelance opportunity is remote and hours are flexible, so you can work whenever is best for you
GenAI Engineer,Brennan Sourcing,GenAI Engineer | Help deliver cutting edge GenAI solutions across the Enterprise | Retail Sector
Research Engineer - Machine Learning,Lockheed Martin Australia Pty Ltd,Join a talented and innovative team  innovative team who are contributing to groundbreaking research and the development of next-generation solutions.
AI Solution Engineer,Urbis Ltd,Join our Tech & Digital team as an AI Solution Engineer to advance uKnow, developing AI products on Azure Cloud for efficiency and compliance.
AI Tools Consultant,Morgan McKinley,Leverage your AI expertise to drive business growth in large top tier organisation.
Lead/Principal Software Engineer,Lookahead,Bring your love of experimentation and your experience with large scale distributed systems at this AI-focused company
Math Prompt Engineer,Outlier,This freelance opportunity is remote and hours are flexible, so you can work whenever is best for you
Senior Data Engineer - AI Initiatives,FourQuarters Recruitment,Senior Data Engineer for a greenfield opportunity to drive AI initiatives and AI-driven decision-making, re-shaping the future in the health industry.
Math Prompt Engineer,Outlier,This freelance opportunity is remote and hours are flexible, so you can work whenever is best for you
Machine Learning Engineer – Autonomous Systems,The Onset,Do you want to help bring AI agents into the world of robotics?
Director, AI and Data Foundations,Optus,Lead AI strategy at Optus, building secure AI solutions & driving data innovation for real impact—all with flexibility, a great salary & bonuses!
Data and AI Analyst,Servcorp Limited,The role is responsible for supporting internal data-driven decision-making processes by leveraging artificial intelligence and machine learning.
Full Stack Engineer - GenAI,Davidson,Seasoned Full Stack Engineer with expertise in Generative AI and enterprise-scale cloud architecture to join our team!
AI Implementation Specialist,Henderson Advocacy,Come join us at Henderson as an AI Guru.
Salesforce Engineer - AI & Intelligent Automation - Dayrate upto $1,200,Preacta Recruitment,Transformative Salesforce project embarking on an ambitious redesign that  that will redefine customer interaction using AI
Digital AI consultant,Arc Twenty Two,Make a Real Difference with AI!
Join our dynamic team as a AI Consultant and help us drive technology that supports the people who need it the most.
Associate Director, Product Manager - AI Native Telco,Optus,Lead groundbreaking AI products, drive innovation, and shape the future of tech at Optus in our dynamic, fast-growing AI division
Quality Assurance Engineer,Future Secure AI Pty Ltd,Future Secure AI is a tech company that is jointly developed with one of the world's largest financial institutions.
Software Engineer, Early Career, NetSoft,Google,Participate in design, implementation and support of the data systems that manage Google's network physical topology data.
AI Solutions Architect - Microsoft Copilot & Power Platform Specialist,Fusion5,Fusion5 is looking for someone who has the capability to lead our Australian based Copilot and AI adoption presales, architecture and implementation.
Technical Product Manager- AI,Optus,Drive AI innovation at Optus! Lead AI asset development, ensure real-time performance, and shape the future of AI in a flexible, high-impact role.
AI/ML Computational Science Senior Manager/Manager/Associate Manager/Specialist,Accenture,Develop cutting-edge AI/ML solutions for Telstra-Accenture joint venture. Build scalable pipelines, optimise model performance.
Associate Director, Product Manager - AI Native Telco,Optus,Lead groundbreaking AI products, drive innovation, and shape the future of tech at Optus in our dynamic, fast-growing AI division
Research Engineer - Machine Learning,Lockheed Martin Australia Pty Ltd,Join a talented and innovative team  innovative team who are contributing to groundbreaking research and the development of next-generation solutions.
Gen AI and Data Consultant,Morgan McKinley,Bridge the gap between tech & business, drive strategy, and solve problems with Gen Ai & Data. Must have commercial experience. Hybrid role.
Data Engineer / Scientist,Downer EDI Limited,Are you passionate about leveraging machine learning and AI to drive innovation?
AI Architect,Launch Recruitment Pty Ltd,Design and implement AI-driven solutions in a cloud-native environment, driving innovation and scalability across a national enterprise.
Software Engineer, Chrome OS Machine Intelligence,Google,Lead design reviews with peers and stakeholders to decide amongst available technologies.
Senior GCP DevOps Engineer,Nuage Technology Group,We are looking for a Mid or Senior GCP DevOps Engineer to join a fast-growing AI team within a leading enterprise company
Signal Processing Engineer - Defence,Kinexus,Supporting a Defence SME in a search for a Signal Processing Engineer, which pulls experience from signal processing, AI/ML and software development.
Software Engineer,Cyberoo Pty Ltd,Joining Cyberoo Pty's talented team, build cutting-edge cybersecurity solutions, and support the company's growth.
Senior Data & AI Engineer (Power BI & Analytics),InsightFactory.ai Pty Ltd,Insightfactory.ai is seeking a Senior Data & AI Engineer (Power BI & Analytics) to develop high-impact, innovative Data Viz Power BI solutions.
Senior Software Engineer,Just Digital People,Jess (0461 299 695) at JDP is looking out for the top .NET developers across AU to join a Fin-Tech scale up who offer fantastic salaries plus ESOP
AI-Solution Architect,Emesent,As an AI Solution Architect, you will play a pivotal role in shaping and executing Emesent’s AI strategy.
Senior Machine Learning Engineer,Launch Recruitment Pty Ltd,Excellent opportunity to work for a leading organisation in Sydney as you work across multiple initiatives including building capabilities for Gen AI
Senior AI Developer – AI-Powered Automation & Integration,Interpro People,Lead the development of scalable, intelligent systems using AI, automation, API integration, and deep tech for an innovative technology business.
Senior Software Engineer - AI Technical Products,Optus,Join our AI division to drive innovation, lead cutting-edge tech solutions, and enjoy flexible hybrid work with career growth opportunities.
AI Specialist,Paxus,Work with a dynamic team of AI as an AI specialist to optimize the configuration of AI product
Associate Director, Product Manager - AI Native Telco,Optus,Lead groundbreaking AI products, drive innovation, and shape the future of tech at Optus in our dynamic, fast-growing AI division
Senior Data & AI Engineer (Power BI & Analytics),InsightFactory.ai Pty Ltd,Insightfactory.ai is seeking a Senior Data & AI Engineer (Power BI & Analytics) to develop high-impact, innovative Data Viz Power BI solutions.
AI-Solution Architect,Emesent,As an AI Solution Architect, you will play a pivotal role in shaping and executing Emesent’s AI strategy.
Senior AI Researcher,Brunel,We have an exciting opportunity for a Senior AI Researcher to join our clients AI for Trading Team
Salesforce Engineer - AI & Intelligent Automation - Dayrate upto $1,200,Preacta Recruitment,Transformative Salesforce project embarking on an ambitious redesign that  that will redefine customer interaction using AI
Software Engineer, Chrome OS Machine Intelligence,Google,Write product or system development code.
Software Engineer,Power Tech Consulting,Design and implement innovative data solutions using Python, Power BI, and AI/ML to deliver insights from operational and safety data.
Research Data Engineer,Charles Sturt University,Join AICF as a Research Data Engineer! Work on impactful AI/Cyber projects, grow professionally, and collaborate with a dynamic team. Apply now!
Senior ML / AI Consultant,Australia Wide Engineering Recruitment,Seeking an experienced ML/AI Engineer with commercial MLOps experience; excellent Python coding skills and a great communicator
Software Engineer, Android Consumer Experiences,Google,Collaborate with cross-functional teams to deliver new features and products, including managing project priorities, deadlines, and deliverables.
Research Engineer - Radar Imaging,Lockheed Martin Australia Pty Ltd,Push boundaries of radar imaging technology and contribute to advancements in radar technology and its applications across various industries.
Research Data Engineer,Charles Sturt University,Join AICF as a Research Data Engineer! Work on impactful AI/Cyber projects, grow professionally, and collaborate with a dynamic team. Apply now!
Software Engineer, NetSoft,Google,Participate in design, implementation and support of the data systems that manage Google's network physical topology data.
Research Engineer - Electronic Warfare,Lockheed Martin Australia Pty Ltd,Great opportunity working with experts in the field of electronic warfare, supporting internal and external research projects.
Software Engineer, Android, Photos,Google,Our engineers develop the next-generation technologies that change how billions of users connect, explore, and interact with information.
Senior Machine Learning Engineer,AustralianSuper,Drive the strategic development of AustralianSuper's machine learning models to support data driven decision-making.
Solution Architect - GenAI,Brennan Sourcing,Solution Architect - GenAI | Retail Sector | Drive GenAI architecture across the business
Senior ML Ops Engineer,Talenza,Senior ML Ops Engineer - GenAI - FS - Sydney - $230,000 Inc Super + Bonus
Sales Engineer - Smart Buildings,Conserve It,This is an excellent opportunity for a Sales Engineer to join us as a Sales Engineer (Building Automation / Smart Buildings) in Melbourne.
Director, AI and Data Foundations,Optus,Lead AI strategy at Optus, building secure AI solutions & driving data innovation for real impact—all with flexibility, a great salary & bonuses!
Senior Credit Risk Data Scientist/ Senior Artificial Intelligence Engineer,Rich Data Corporation,Work closely with customers to develop AI-driven solutions for solving complex credit decisions in the SME and Commercial lending space.
AI Product Manager,Nine,As our AI Product Manager, you will shape the future of audience engagement and commercial strategies through development and implementation.
Principal Data Scientist - AI & NLP,Correlate Resources,Lead advanced NLP and ML initiatives, improving LLM outputs, implementing MLOps, and leveraging Python and SQL expertise to drive AI solutions
Software Engineer, Mobile, iOS, Photos,Google,Participate in, or lead design reviews with peers and stakeholders to decide amongst available technologies.
Software Engineer (Part time) - long term contract,Helix Technology Services,Part time Software Engineer required to work on a large mission-critical cloud security program for an intelligence community customer.
Senior React/Typescript Engineer,Aurec,Senior Product Engineer (React/Typescript)
Permanent Role 
Fully Remote 
$180,000 - $200,000kpa + potential equity
Staff Software Engineer, Backend, Google Photos,Google,Google's software engineers develop the next-generation technologies that change how billions of users connect, explore, and interact with information
Full Stack Developer,Accenture,This role combines expertise in both front-end & back-end devt w/ a strong focus on integrating AI/ML models into scalable & user-friendly solutions
Full Stack Developer,Accenture,This role combines expertise in both front-end & back-end devt w/ a strong focus on integrating AI/ML models into scalable & user-friendly solutions
Software Engineer, Android Consumer Experiences,Google,Collaborate with cross-functional teams to deliver new features and products, including managing project priorities, deadlines, and deliverables.
Senior GCP DevOps Engineer,Nuage Technology Group,We are looking for a Mid or Senior GCP DevOps Engineer to join a fast-growing AI team within a leading enterprise company
Technical Product Lead - AI,Brennan Sourcing,Technical Product Lead - GenAI | Work on the cutting edge of GenAI
Python Engineer,Just Digital People,Exciting opportunity for a Software Engineer with extensive Python and React.js experience looking to sink their teeth into all things AI.
Research Engineer - Signal Processing,Lockheed Martin Australia Pty Ltd,Great opportunity working with experts in the field of signal processing, supporting internal and external research projects.
Data & AI Consultant,Accenture,Data & AI Value Strategist needed to define transformative AI solutions for the public sector. Unmatched benefits.
Full-stack Software Engineer,The Onset,Want to help build a no-code platform as it's scaling into the US?
Software Engineer, Android Video Editing, Google Photos,Google,Google's software engineers develop the next-generation technologies that change how billions of users connect, explore, and interact with information
Staff Software Engineer,Commonwealth Bank – Technology,Looking for a Staff Software Engineer with experience in C#, .Net Framework, Rest APIs, Microservices, containerisation and Cloud.
Lead Data Engineer,Talenza,Lead Data Engineer - Generative AI - Sydney - FS - $230,000 + Bonus
IT Expert,Cocoon SDA Care,apply now
Quality Assurance Engineer,Future Secure AI Pty Ltd,Future Secure AI is a tech company that is jointly developed with one of the world's largest financial institutions.
Senior DevOps Engineer,Future Secure AI Pty Ltd,Future Secure AI is a tech company that is jointly developed with one of the world's largest financial institutions.
Senior Machine Learning Platform Engineer,Endeavour Group,experience with Azure,Google Cloud Platform (GCP),  BigQuery, Dataflow, Dataproc, Pub/Sub, Cloud Storage, and Cloud Function, Technical leadership
Data & AI Consultant,Accenture,Innovative AI strategy work with Accenture. Upskill, grow your career, & make a real impact in the public sector.
MLOps Engineer - 6months contract,Alchemy Recruitment Consulting Pty Ltd,Join this leading energy & resources business as a MLOps Engineer for an initial 6-month contract with high likely to be extended
AI Innovation Lead,News Corp Australia,Shape the future of AI at News Corp Australia by driving cutting-edge projects to enhance audience experiences and improve internal efficiencies
Technical Procurement Engineer (AU),DroneShield,We''re seeking a Technical Procurement Engineer to support our development and design teams by sourcing critical components for our advanced systems.
Data & AI Analyst,Accenture,Accelerate your career with a leading global consultancy. Leverage data & AI to drive tangible business impact.
Engineering Manager, Google Photos,Google,Set and communicate team priorities that support the broader organization's goals
Senior Consultant - AI,The Onset,AI Strategy and delivery work within a funded startup consultancy.
Gen AI Trainer,Cognizant Technology Solutions Australia Pty Ltd,Deliver training courses from Cognizant’s course catalog in generative AI specialization.
PropNova Software Engineer,The Property Investors Alliance Pty Ltd,A true leader to drive transition to a next-generation digital property management platform & AI-driven solutions adapted across the broader market.
Technical Lead (AI-Focused),Scout Talent,Lead NetEngine’s AI-driven transformation! Drive revenue growth, innovation, and market leadership in a high-energy, in-office environment.
Senior Software Engineer, iOS Video Editing, Google Photos,Google,Google's software engineers develop the next-generation technologies that change how billions of users connect, explore, and interact with information
Senior Data Engineer (GCP),Talenza,Senior Data Engineer (GCP) - Sydney - FS - $190k + Bonus
AI Product Manager,News Corp Australia,Shape the future of AI products! Lead innovative AI-powered solutions, drive strategy, and collaborate with cross-functional teams to deliver impact
AI Product Trainer,Thomson Reuters (Professional) Australia,Thomson Reuters are on the lookout for an enthusiastic AI Product Trainer to join our AEM Customer Training Team.
Principal Software Engineer,Commonwealth Bank – Technology,Looking for a Principal Software Engineer for our Workflow Crew in OpsTech that helps build workflow platform for our businesses!
Test Analyst,Lime Recruitment,Join a dynamic Queensland Government team as an innovative Test Analyst. Contract to 30/06/2025 with two 6-month extensions; Carseldine, remote.
Engineering Manager, Payments,Google,As a Software Engineering Manager, manage your project goals, contribute to product strategy and help develop your team.
Telecom Ops Engineer (English & Mandarin),Amazon Web Services,Join Amazon Connect Sydney! Bilingual VoIP expert needed to revolutionise customer service.
MS Engineer (L3): Network - Juniper | Perth,NTT DATA,You are responsible to manage high complexity tickets, conduct advanced tasks and provide resolution to a diverse range of complex problems.
Test Lead,Lime Recruitment,Join a top Queensland government department as Test Lead. Contract to 30/06/2025 with potential two 6-month extensions; Carseldine and remote.
Data Engineer (Executive Manager),Quantium,We are seeking an accomplished Executive Manager to lead our Retail Data Engineering practice in Sydney.
AI Engineer,Lendi Group,We are seeking an experienced AI Engineer to design, develop, and deploy AI systems that drive agentic AI Automation within the property buying and...
AI Engineer,Virtusa,The Agentic AI Engineer will be responsible for developing, optimizing, and deploying AI-powered autonomous agents on GCP. This role involves fine-...
AI/ML Engineer,Cognizant Technology Solutions Australia Pty Ltd,As an AI/ML Engineer, you will be responsible for designing, developing, and deploying machine learning models within a Databricks environment, lev...
AI Engineer,Macquarie Group Limited,As an AI Engineer, you'll be at the forefront of developing and deploying innovative AI solutions. You'll take end-to-end ownership of your product...
Machine Learning Engineer, 2026 Graduate Australia & New Zealand,Atlassian,You will report to a manager in the AI Experience team within the broader Central AI group. The team is tasked to improve the quality of AI feature...
AI Engineer,Avanade Australia Pty Ltd,As an AI Engineering Consultant at Avanade, you will leverage extensive knowledge of Azure AI services to enhance client business processes. You wi...
AI Engineer,Avanade Australia Pty Ltd,As an AI Engineering Consultant at Avanade, you will leverage extensive knowledge of Azure AI services to enhance client business processes. You wi...
AI Engineer,Avanade Australia Pty Ltd,As an AI Engineering Consultant at Avanade, you will leverage extensive knowledge of Azure AI services to enhance client business processes. You wi...
Senior Machine Learning Engineer,Atomi,Our mission is to help unlock the world’s potential by optimising the way we teach and learn. With a unique blend of technology and creativity, we ...
Machine Learning Engineer, 2025/2026 Intern Australia & New Zealand,Atlassian,As a Machine Learning intern, you will report to a manager in the Core Machine Learning team within the broader Analytics group. The team is tasked...
Senior Machine Learning Engineer,Luxury Escapes,As a Senior ML Engineer, you will play a key role in developing and implementing cutting-edge machine learning solutions to solve complex business ...
Machine Learning Engineer - Trust and Safety, NLP (Australia),TikTok,Minimum Qualifications • 3+ years experience in one or more of the areas: machine learning, deep learning, computer vision, NLP, Audio, content und...
AI Architect,Virtusa,The Agentic AI Architect will design, develop, and implement autonomous AI agents using LLMs (Large Language Models), GenAI, and multi-agent system...
Senior Backend Engineer - Search Quality,Canva,We are responsible for the AI, machine learning, and backend infrastructure that powers Canva’s Discovery Experience—from collecting data and signa...
Gen AI Intern,St Trinity Property Group,We are looking for a highly practical, hands-on Gen AI Intern to help implement Generative AI tools across sales, marketing, operations, talent, an...
Software Developer,The University of Adelaide,In the first position, you will work on developing and implementing Machine Learning models, support developing attacks and defences, and support d...
Solutions Engineer - AI Infrastructure,Cisco Systems Australia,We are seeking a Senior Solutions Engineer - Artificial Intelligence (AI) to join our dynamic sales team. As a Solutions Engineer (AI), you will dr...
Systems Engineer | AU (Product Owner),Harrison-AI Pty Ltd,Your role is to provide the systems thinking, systems design, and support to product quality throughout the product lifecycle and ensuring the prod...
Senior Machine Learning Platform Engineer,Endeavour Group Limited,As a Machine Learning Platform Engineer, you'll take end-to-end ownership of your product in a modern DevOps culture. You'll be responsible for arc...
Senior Software Engineer,Macquarie Group Limited,At Macquarie, we are working to create lasting value for our communities, our clients and our people. We are a global financial services group oper...
Senior Data & AI Engineer,CyberCX,Engage with customers to solve their current and most challenging data and AI use-cases. You will also work as a part of a wider practice with abil...
Senior Managing Consultant/Director, AI Strategy (Financial Services),Mastercard,Reporting to the Principal and working closely with the Mastercard AI team, the Senior Managing Consultant, AI Strategy will spearhead AI-driven co...
IT Support Engineer (Linux & Infrastructure Focus),Advanced Navigation,Your primary responsibility is to ensure team productivity by providing IT helpdesk support to a rapidly expanding global company. You will enable ...
